Name,Price,Link
The Most Perfect Thing: Inside (and Outside) a Bird's Egg,£42.96,../../../the-most-perfect-thing-inside-and-outside-a-birds-egg_938/index.html
Immunity: How Elie Metchnikoff Changed the Course of Modern Medicine,£57.36,../../../immunity-how-elie-metchnikoff-changed-the-course-of-modern-medicine_900/index.html
Sorting the Beef from the Bull: The Science of Food Fraud Forensics,£44.74,../../../sorting-the-beef-from-the-bull-the-science-of-food-fraud-forensics_736/index.html
Tipping Point for Planet Earth: How Close Are We to the Edge?,£37.55,../../../tipping-point-for-planet-earth-how-close-are-we-to-the-edge_643/index.html
"The Fabric of the Cosmos: Space, Time, and the Texture of Reality",£55.91,../../../the-fabric-of-the-cosmos-space-time-and-the-texture-of-reality_572/index.html
Diary of a Citizen Scientist: Chasing Tiger Beetles and Other New Ways of Engaging the World,£28.41,../../../diary-of-a-citizen-scientist-chasing-tiger-beetles-and-other-new-ways-of-engaging-the-world_517/index.html
The Origin of Species,£10.01,../../../the-origin-of-species_499/index.html
The Grand Design,£13.76,../../../the-grand-design_405/index.html
Peak: Secrets from the New Science of Expertise,£16.28,../../../peak-secrets-from-the-new-science-of-expertise_389/index.html
"The Elegant Universe: Superstrings, Hidden Dimensions, and the Quest for the Ultimate Theory",£13.03,../../../the-elegant-universe-superstrings-hidden-dimensions-and-the-quest-for-the-ultimate-theory_245/index.html
"The Disappearing Spoon: And Other True Tales of Madness, Love, and the History of the World from the Periodic Table of the Elements",£57.35,../../../the-disappearing-spoon-and-other-true-tales-of-madness-love-and-the-history-of-the-world-from-the-periodic-table-of-the-elements_244/index.html
"Surely You're Joking, Mr. Feynman!: Adventures of a Curious Character",£25.83,../../../surely-youre-joking-mr-feynman-adventures-of-a-curious-character_227/index.html
Seven Brief Lessons on Physics,£30.60,../../../seven-brief-lessons-on-physics_219/index.html
The Selfish Gene,£29.45,../../../the-selfish-gene_81/index.html
